{
  "schema_version": "build-manifest-v1",
  "package_version": "1.2.3",
  "source_sha": "dddddddddddddddddddddddddddddddddddddddd",
  "development_distance": 4,
  "distributions": {
    "wheel": {
      "filename": "traefik_certificate_exporter-1.2.3-py3-none-any.whl",
      "sha256": "aaaaaaaaaaaaaaaaaaaaaaaaaaaaaaaaaaaaaaaaaaaaaaaaaaaaaaaaaaaaaaaa"
    },
    "sdist": {
      "filename": "traefik_certificate_exporter-1.2.3.tar.gz",
      "sha256": "bbbbbbbbbbbbbbbbbbbbbbbbbbbbbbbbbbbbbbbbbbbbbbbbbbbbbbbbbbbbbbbb"
    }
  },
  "image_plan": {
    "context": ".",
    "dockerfile": "docker/Dockerfile",
    "target": "runtime",
    "base_digest": "sha256:cccccccccccccccccccccccccccccccccccccccccccccccccccccccccccccccc",
    "build_args": {
      "POETRY_VERSION": "2.4.2",
      "REVISION": "dddddddddddddddddddddddddddddddddddddddd",
      "VERSION": "1.2.3",
      "WHEEL_PATH": "dist/traefik_certificate_exporter-1.2.3-py3-none-any.whl",
      "WHEEL_SHA256": "aaaaaaaaaaaaaaaaaaaaaaaaaaaaaaaaaaaaaaaaaaaaaaaaaaaaaaaaaaaaaaaa"
    },
    "labels": {
      "org.opencontainers.image.title": "traefik-certificate-exporter",
      "org.opencontainers.image.description": "Export certificates from Traefik ACME storage",
      "org.opencontainers.image.source": "https://github.com/ravensorb/traefik-certificate-exporter",
      "org.opencontainers.image.version": "1.2.3",
      "org.opencontainers.image.revision": "dddddddddddddddddddddddddddddddddddddddd"
    },
    "fingerprint": "174b98ed9b4e5a3fa2d3a04b4382a4c9a443cc3596d6801dd672fb6c8c59295b"
  }
}
